{
  "timeline_id": "palace_1930_canonical",
  "universe_id": "palace_1930",
  "version": "0.5.0",
  "status": "specified",
  "timezone": "Europe/Paris",
  "calendar": {
    "gala_date": "1934-02-17",
    "discovery_date": "1934-02-18"
  },
  "invariance_contract": {
    "crime_facts_identical_across_variants": true,
    "culprit_method_motive_and_core_times_locked": true,
    "social_overlays_may_change_by_variant": true,
    "rule": "Les faits matériels du crime, les déplacements des quatre rôles centraux, l'ingestion, la mort et la découverte restent identiques. Les rôles optionnels peuvent ajouter des scènes parallèles ou être remplacés par des documents sans modifier ces faits."
  },
  "locked_windows": {
    "medical_bag_unattended": {"start": "15:41", "end": "15:45"},
    "preparation_removed": {"start": "15:42", "end": "15:44"},
    "service_key_held_by_culprit": {"start": "15:50", "end": "16:04"},
    "bottle_substitution": {"start": "15:57", "end": "16:02"},
    "toxic_ingestion": {"start": "22:21", "end": "22:22"},
    "victim_enters_locked_office": "22:45",
    "estimated_death": "23:08",
    "body_discovered": "07:55"
  },
  "events": [
    {
      "id": "evt_001",
      "date": "1934-02-17",
      "time": "14:12",
      "phase": "afternoon_preparation",
      "location": "reception",
      "classification": "core_fact_variable_carrier",
      "actors": ["npc_victim"],
      "fact": "Une copie authentique de l'acte de propriété atteint le Palace Belladone dans un pli notarial.",
      "proof_function": "Fournir une référence authentique permettant de comparer le faux codicille.",
      "variants": "Le porteur et le moment de remise au groupe sont définis dans variant_delivery.json."
    },
    {
      "id": "evt_002",
      "date": "1934-02-17",
      "time": "14:30",
      "phase": "afternoon_preparation",
      "location": "petit_salon",
      "classification": "core_fact_variable_carrier",
      "actors": ["npc_victim"],
      "fact": "Auguste reçoit les conditions finales d'une vente du palace qui écarterait Camille de la succession opérationnelle.",
      "proof_function": "Établir que le faux codicille et la mort d'Auguste ont une conséquence financière immédiate."
    },
    {
      "id": "evt_003",
      "date": "1934-02-17",
      "time": "14:47",
      "phase": "afternoon_preparation",
      "location": "bureau_prive",
      "classification": "core",
      "actors": ["npc_victim", "role_04"],
      "fact": "Lucien remet à Auguste le dossier de succession contenant le codicille suspect.",
      "proof_function": "Fixer la dernière chaîne de possession connue du dossier."
    },
    {
      "id": "evt_004",
      "date": "1934-02-17",
      "time": "14:55",
      "phase": "afternoon_preparation",
      "location": "bureau_prive",
      "classification": "core",
      "actors": ["npc_victim", "role_04"],
      "fact": "Auguste relève une formulation inhabituelle et un sceau incohérent sur le codicille.",
      "proof_function": "Établir que la fraude est découverte avant le meurtre."
    },
    {
      "id": "evt_005",
      "date": "1934-02-17",
      "time": "15:03",
      "phase": "afternoon_preparation",
      "location": "bureau_prive",
      "classification": "core",
      "actors": ["npc_victim", "role_04"],
      "fact": "Auguste dicte une note annonçant qu'il remettra le dossier à la police après le petit déjeuner du lendemain.",
      "proof_function": "Créer la menace immédiate qui déclenche le passage à l'acte."
    },
    {
      "id": "evt_006",
      "date": "1934-02-17",
      "time": "15:18",
      "phase": "afternoon_preparation",
      "location": "salon_familial",
      "classification": "core",
      "actors": ["npc_victim", "role_01"],
      "fact": "Camille confronte Auguste. Celui-ci annonce qu'il contestera le codicille, suspendra la succession et saisira la police.",
      "proof_function": "Établir la connaissance du danger et le mobile personnel du coupable."
    },
    {
      "id": "evt_007",
      "date": "1934-02-17",
      "time": "15:26",
      "phase": "afternoon_preparation",
      "location": "hall_prive",
      "classification": "core_fact_variable_carrier",
      "actors": ["role_01"],
      "fact": "Camille reçoit une dernière mise en demeure : sans héritage rapide, ses dettes deviennent exigibles.",
      "proof_function": "Rendre le mobile financier immédiat et mesurable."
    },
    {
      "id": "evt_008",
      "date": "1934-02-17",
      "time": "15:34",
      "phase": "crime_preparation",
      "location": "petit_salon",
      "classification": "core",
      "actors": ["role_01", "role_03"],
      "fact": "Camille simule un malaise et obtient l'examen du docteur Renaud.",
      "proof_function": "Créer l'accès à la trousse médicale sans prouver encore le vol."
    },
    {
      "id": "evt_009",
      "date": "1934-02-17",
      "time": "15:41",
      "phase": "crime_preparation",
      "location": "petit_salon",
      "classification": "core",
      "actors": ["role_03"],
      "fact": "Gabriel est appelé quelques minutes dans les cuisines et laisse sa trousse fermée dans le petit salon.",
      "proof_function": "Définir la seule fenêtre crédible de prélèvement."
    },
    {
      "id": "evt_010",
      "date": "1934-02-17",
      "time": "15:43",
      "phase": "crime_preparation",
      "location": "petit_salon",
      "classification": "core_secret",
      "actors": ["role_01"],
      "fact": "Camille ouvre la trousse et prélève une préparation toxique entièrement fictive.",
      "proof_function": "Établir l'origine de la préparation sans fournir d'information exploitable sur une substance réelle."
    },
    {
      "id": "evt_011",
      "date": "1934-02-17",
      "time": "15:45",
      "phase": "crime_preparation",
      "location": "petit_salon",
      "classification": "core",
      "actors": ["role_01", "role_03"],
      "fact": "Gabriel revient. La trousse paraît refermée et Camille affirme aller mieux.",
      "proof_function": "Clore la fenêtre de prélèvement."
    },
    {
      "id": "evt_012",
      "date": "1934-02-17",
      "time": "15:50",
      "phase": "crime_preparation",
      "location": "reception_service",
      "classification": "core",
      "actors": ["role_01", "role_02"],
      "fact": "Camille emprunte une clé de service en prétextant vouloir récupérer un portrait familial dans les appartements d'Auguste.",
      "proof_function": "Établir l'accès matériel au flacon."
    },
    {
      "id": "evt_013",
      "date": "1934-02-17",
      "time": "15:56",
      "phase": "crime_preparation",
      "location": "couloir_prive",
      "classification": "core_fact_variable_witness",
      "actors": ["role_01"],
      "fact": "Camille est vu dans le couloir privé alors que son alibi le place dans le grand salon.",
      "proof_function": "Contredire l'alibi sans révéler directement la substitution."
    },
    {
      "id": "evt_014",
      "date": "1934-02-17",
      "time": "15:57",
      "end_time": "16:02",
      "phase": "crime_preparation",
      "location": "appartements_auguste",
      "classification": "core_secret",
      "actors": ["role_01"],
      "fact": "Camille remplace le contenu du flacon de gouttes digestives d'Auguste par la préparation fictive, puis remet le flacon à sa place.",
      "proof_function": "Constituer l'action meurtrière préparatoire."
    },
    {
      "id": "evt_015",
      "date": "1934-02-17",
      "time": "16:04",
      "phase": "crime_preparation",
      "location": "reception_service",
      "classification": "core",
      "actors": ["role_01", "role_02"],
      "fact": "Camille rend la clé. L'emprunt reste inscrit dans le registre.",
      "proof_function": "Fermer la fenêtre d'accès et produire une preuve documentaire."
    },
    {
      "id": "evt_016",
      "date": "1934-02-17",
      "time": "16:20",
      "phase": "fraud_verification",
      "location": "chambre_invite",
      "classification": "core_fact_variable_carrier",
      "actors": [],
      "fact": "Le pli notarial est ouvert et l'acte authentique confirme que le codicille favorable à Camille est incompatible avec le dossier officiel.",
      "proof_function": "Fournir la preuve externe de la fraude."
    },
    {
      "id": "evt_017",
      "date": "1934-02-17",
      "time": "16:32",
      "phase": "fraud_verification",
      "location": "vestiaire_des_dossiers",
      "classification": "core_fact_variable_carrier",
      "actors": [],
      "fact": "L'incohérence du sceau et de la formulation est documentée indépendamment.",
      "proof_function": "Empêcher que la fraude repose uniquement sur la parole de Lucien."
    },
    {
      "id": "evt_018",
      "date": "1934-02-17",
      "time": "17:03",
      "end_time": "17:20",
      "phase": "false_leads",
      "location": "ancien_pavillon_thermal",
      "classification": "core",
      "actors": ["role_02"],
      "fact": "Jeanne quitte le service pendant dix-sept minutes afin de cacher le grand livre falsifié.",
      "proof_function": "Créer une absence suspecte indépendante du meurtre."
    },
    {
      "id": "evt_019",
      "date": "1934-02-17",
      "time": "17:07",
      "phase": "false_leads",
      "location": "bibliotheque",
      "classification": "core",
      "actors": ["role_04"],
      "fact": "Lucien cache ses faux reçus parmi les dossiers de la bibliothèque.",
      "proof_function": "Créer une fausse piste documentaire distincte du faux codicille."
    },
    {
      "id": "evt_020",
      "date": "1934-02-17",
      "time": "18:20",
      "phase": "final_preparation",
      "location": "bureau_prive",
      "classification": "core",
      "actors": ["npc_victim", "role_04"],
      "fact": "Auguste confirme le rendez-vous de 08:30, fait préparer le dossier et maintient son intention de contacter la police.",
      "proof_function": "Montrer que le danger pour Camille est toujours actif après la substitution."
    },
    {